{
  "success": true,
  "data": {
    "findings": [
      {
        "kind": "tsc",
        "severity": "error",
        "message": "Example diagnostic message",
        "file": "src/index.ts",
        "range": {
          "startLine": 1,
          "startCol": 1,
          "endLine": 1,
          "endCol": 10
        },
        "ruleId": "TS1234",
        "confidence": 1.0
      }
    ],
    "patches": [
      {
        "path": "src/index.ts",
        "patch": "*** unified diff here ***"
      }
    ],
    "metrics": {
      "filesAnalyzed": 12,
      "diagnostics": 3,
      "duplicationCandidates": 2,
      "estimatedComplexityHotspots": 1,
      "filesModified": 1,
      "patchesGenerated": 2
    }
  },
  "metadata": {
    "tool_version": "0.2.0",
    "execution_time_ms": 1234
  },
  "logs": [
    "Loaded 12 files"
  ]
}
